{
  "pack_version": 1,
  "name": "solo",
  "display_name": "Solo Dev (dev â†’ main, no PR)",
  "description": "Fast local workflow with verified checkpoints, cherry-pick submit, and minimal docs.",
  "defaults": {
    "profile": "solo",
    "integration_branch": "dev",
    "release_branch": "main",
    "submit_strategy": "cherry-pick",
    "require_clean_tree": true,
    "require_verification": true,
    "protected_branches": ["main"]
  },
  "templates": {
    "AGENTS.md": "templates/AGENTS.md.tmpl",
    "CLAUDE.md": "templates/CLAUDE.md.tmpl",
    "bundle.md": "templates/bundle.md.tmpl",
    "claude-skill": "templates/claude-skill.md.tmpl",
    "claude-cmd-bundle": "templates/claude-cmd-bundle.md.tmpl",
    "claude-cmd-submit": "templates/claude-cmd-submit.md.tmpl",
    "claude-cmd-resume": "templates/claude-cmd-resume.md.tmpl"
  },
  "init_actions": [
    {
      "type": "ensure_gitignore_entry",
      "path": ".gitignore",
      "line": ".runr/runs/"
    },
    {
      "type": "ensure_gitignore_entry",
      "path": ".gitignore",
      "line": ".runr-worktrees/"
    },
    {
      "type": "ensure_gitignore_entry",
      "path": ".gitignore",
      "line": ".runr/orchestrations/"
    },
    {
      "type": "create_file_if_missing",
      "path": "AGENTS.md",
      "template": "AGENTS.md",
      "mode": "0644"
    },
    {
      "type": "create_file_if_missing",
      "path": "CLAUDE.md",
      "template": "CLAUDE.md",
      "mode": "0644",
      "when": { "flag": "with_claude" }
    },
    {
      "type": "create_file_if_missing",
      "path": ".claude/skills/runr-workflow/SKILL.md",
      "template": "claude-skill",
      "mode": "0644",
      "when": { "flag": "with_claude" }
    },
    {
      "type": "create_file_if_missing",
      "path": ".claude/commands/runr-bundle.md",
      "template": "claude-cmd-bundle",
      "mode": "0644",
      "when": { "flag": "with_claude" }
    },
    {
      "type": "create_file_if_missing",
      "path": ".claude/commands/runr-submit.md",
      "template": "claude-cmd-submit",
      "mode": "0644",
      "when": { "flag": "with_claude" }
    },
    {
      "type": "create_file_if_missing",
      "path": ".claude/commands/runr-resume.md",
      "template": "claude-cmd-resume",
      "mode": "0644",
      "when": { "flag": "with_claude" }
    }
  ]
}
